{
  "document_type": "research_summary",
  "locale": "zh-CN",
  "meta": {
    "title": "AI 文档生成方案研究摘要（示例）",
    "subtitle": "用于展示研究摘要结构；内容是待验证假设，不代表已完成的市场研究。",
    "eyebrow": "Momo Paper / research_summary / zh-CN",
    "date": "2026-07-03",
    "author": "Momo Paper"
  },
  "sections": {
    "thesis": {
      "body": [
        "研究问题：直接输出 HTML 与输出结构化 DSL 再由设计系统渲染相比，哪种方式在 token 成本、一次成功率、视觉一致性和修改成本上更有效？",
        "本页只展示研究摘要的信息结构，以下内容是待验证假设。"
      ]
    },
    "key_findings": [
      {
        "title": "观察 1：直接生成 HTML 会重复布局和样式",
        "description": "DSL 可以把重复的视觉实现移到渲染器中；实际收益需要在相同任务和模型下测量。",
        "evidence": "待按 docs/benchmark-protocol.md 收集"
      },
      {
        "title": "观察 2：设计令牌可以约束视觉漂移",
        "description": "固定主题理论上能提高一致性，但整体可读性和任务完成质量仍需盲评。",
        "evidence": "待通过公开 A/B 实验验证"
      },
      {
        "title": "观察 3：结构化错误有利于 Agent 自修",
        "description": "validate --json 提供路径、行号和块名，可测量首次通过率和平均修复轮数。",
        "evidence": "CLI 能力已实现；效果数据待采集"
      }
    ],
    "implications": {
      "body": [
        "Momo Paper 已提供内容结构与视觉渲染分离的工程路径。",
        "在公开原始材料前，不应发布泛化的节省比例或质量合格率。"
      ]
    },
    "method": {
      "body": [
        "选择三种文档任务，固定模型、版本、提示词和参数，每组至少运行 5 次。",
        "保存 prompt、两组输出、API usage、耗时、校验结果、人工修复次数和盲评结果。"
      ],
      "sources": [
        "docs/benchmark-protocol.md"
      ]
    }
  }
}
