{
  "document_type": "research_summary",
  "locale": "zh-CN",
  "meta": {
    "title": "大语言模型在客服场景的应用研究",
    "subtitle": "基于 10 家企业的试点数据分析与可行性评估",
    "eyebrow": "Momo Paper / research_summary / zh-CN"
  },
  "sections": {
    "thesis": {
      "body": [
        "大语言模型（LLM）已具备处理 70-80% 常规客服咨询的能力。在充分准备的前提下，企业可以在 6 个月内实现 AI 客服的规模化部署，并获得正向 ROI。"
      ]
    },
    "key_findings": [
      {
        "title": "LLM 自助解决率达到 78%",
        "description": "在覆盖的常见问题场景中，GPT-4 级别的模型能够直接给出准确答案的比例为 78%。剩余 22% 主要涉及需要人工判断的复杂投诉和个性化需求。",
        "evidence": "基于 10 家试点企业的 15.6 万次对话数据分析"
      },
      {
        "title": "响应时间从 8 分钟降至 30 秒",
        "description": "AI 客服的平均首次响应时间为 3-5 秒，完整问题解决平均 30 秒。相比之下，人工客服的平均响应时间为 8 分钟。",
        "evidence": "对比分析 10 家企业部署前后的服务数据"
      },
      {
        "title": "客户满意度非但没有下降，反而提升",
        "description": "出乎预期的是，AI 客服的客户满意度（CSAT）平均为 4.2/5，高于纯人工客服的 3.8/5。主要原因是响应快、回答一致、24/7 可用。",
        "evidence": "10 家企业部署前后 CSAT 调查数据对比"
      }
    ],
    "implications": {
      "body": [
        "对于客服工单量超过 5 万/年的企业，引入 LLM 客服的 ROI 周期约为 4-6 个月。",
        "关键成功因素包括：高质量的 FAQ 知识库、明确的人工接管规则、持续的模型微调。",
        "风险点：涉及敏感信息（账户安全、退款纠纷）的场景仍需要人工介入，不能过度依赖 AI。"
      ]
    },
    "method": {
      "body": [
        "本研究采用混合方法：定量分析（对话日志、满意度评分、解决时间）+ 定性访谈（客服经理、一线客服代表、客户代表各 5 人）。"
      ],
      "sources": [
        "10 家企业试点数据（2024.06-2024.12）",
        "30 场深度访谈",
        "行业报告：Gartner《AI in Customer Service 2024》"
      ]
    }
  }
}
